[11/10 21:52:52] detectron2 INFO: Rank of current process: 0. World size: 1
[11/10 21:52:52] detectron2 INFO: Environment info:
-------------------------------  ------------------------------------------------------------------------------------------------
sys.platform                     win32
Python                           3.10.19 | packaged by Anaconda, Inc. | (main, Oct 21 2025, 16:41:31) [MSC v.1929 64 bit (AMD64)]
numpy                            2.0.1
detectron2                       0.6 @C:\Users\anna_\OneDrive\Dokumente\Object Detection\vos-main\detectron2\detectron2
detectron2._C                    not built correctly: No module named 'detectron2._C'
DETECTRON2_ENV_MODULE            <not set>
PyTorch                          2.5.1 @C:\Users\anna_\anaconda3\envs\VOS\lib\site-packages\torch
PyTorch debug build              False
torch._C._GLIBCXX_USE_CXX11_ABI  False
GPU available                    Yes
GPU 0                            NVIDIA GeForce RTX 4070 Ti (arch=8.9)
Driver version                   560.94
CUDA_HOME                        None - invalid!
Pillow                           11.1.0
torchvision                      0.20.1 @C:\Users\anna_\anaconda3\envs\VOS\lib\site-packages\torchvision
torchvision arch flags           C:\Users\anna_\anaconda3\envs\VOS\lib\site-packages\torchvision\_C.pyd
fvcore                           0.1.5.post20221221
iopath                           0.1.10
cv2                              4.12.0
-------------------------------  ------------------------------------------------------------------------------------------------
PyTorch built with:
  - C++ Version: 201703
  - MSVC 192930154
  - Intel(R) oneAPI Math Kernel Library Version 2023.1-Product Build 20230303 for Intel(R) 64 architecture applications
  - Intel(R) MKL-DNN v3.5.3 (Git Hash 66f0cb9eb66affd2da3bf5f8d897376f04aae6af)
  - OpenMP 2019
  - LAPACK is enabled (usually provided by MKL)
  - CPU capability usage: AVX2
  - CUDA Runtime 11.8
  - NVCC architecture flags: -gencode;arch=compute_50,code=sm_50;-gencode;arch=compute_60,code=sm_60;-gencode;arch=compute_61,code=sm_61;-gencode;arch=compute_70,code=sm_70;-gencode;arch=compute_75,code=sm_75;-gencode;arch=compute_80,code=sm_80;-gencode;arch=compute_86,code=sm_86;-gencode;arch=compute_90,code=sm_90;-gencode;arch=compute_37,code=sm_37;-gencode;arch=compute_37,code=compute_37
  - CuDNN 90.1
  - Magma 2.5.4
  - Build settings: BLAS_INFO=mkl, BUILD_TYPE=Release, CUDA_VERSION=11.8, CUDNN_VERSION=9.1.0, CXX_COMPILER=C:/cb/pytorch_1000000000000/work/tmp_bin/sccache-cl.exe, CXX_FLAGS=/DWIN32 /D_WINDOWS /GR /EHsc /Zc:__cplusplus /bigobj /FS /utf-8 -DUSE_PTHREADPOOL -DNDEBUG -DUSE_KINETO -DLIBKINETO_NOCUPTI -DLIBKINETO_NOROCTRACER -DLIBKINETO_NOXPUPTI=ON -DUSE_FBGEMM -DUSE_XNNPACK -DSYMBOLICATE_MOBILE_DEBUG_HANDLE /wd4624 /wd4068 /wd4067 /wd4267 /wd4661 /wd4717 /wd4244 /wd4804 /wd4273, LAPACK_INFO=mkl, PERF_WITH_AVX=1, PERF_WITH_AVX2=1, TORCH_VERSION=2.5.1, USE_CUDA=ON, USE_CUDNN=ON, USE_CUSPARSELT=OFF, USE_EXCEPTION_PTR=1, USE_GFLAGS=OFF, USE_GLOG=OFF, USE_GLOO=ON, USE_MKL=ON, USE_MKLDNN=ON, USE_MPI=OFF, USE_NCCL=OFF, USE_NNPACK=OFF, USE_OPENMP=ON, USE_ROCM=OFF, USE_ROCM_KERNEL_ASSERT=OFF, 

[11/10 21:52:52] detectron2 INFO: Command line arguments: Namespace(config_file='C:\\Users\\anna_\\OneDrive\\Dokumente\\Object Detection\\vos-main\\detection\\configs\\VOC-Detection/faster-rcnn/vos.yaml', resume=False, eval_only=False, num_gpus=1, num_machines=1, machine_rank=0, dist_url='tcp://127.0.0.1:49153', opts=[], dataset_dir='C:\\Users\\anna_\\OneDrive\\Dokumente\\Object Detection\\vos-main\\TEMP_COCO', random_seed=0, inference_config='C:\\Users\\anna_\\OneDrive\\Dokumente\\Object Detection\\vos-main\\detection\\configs\\Inference/standard_nms.yaml', test_dataset='coco_ood_val', image_corruption_level=0, iou_min=0.1, iou_correct=0.5, min_allowed_score=0.0, savefigdir='./savefig', visualize=0)
[11/10 21:52:52] detectron2 INFO: Contents of args.config_file=C:\Users\anna_\OneDrive\Dokumente\Object Detection\vos-main\detection\configs\VOC-Detection/faster-rcnn/vos.yaml:
_BASE_: "../../Base-RCNN-FPN.yaml"
MODEL:
  META_ARCHITECTURE: "GeneralizedRCNNLogisticGMM"
  WEIGHTS: "detectron2://ImageNetPretrained/MSRA/R-50.pkl"
#  WEIGHTS: "./data/VOC-Detection/faster-rcnn/faster_rcnn_R_50_FPN_all_logistic/random_seed_0/model_final.pth"

#  PROPOSAL_GENERATOR:
#    NAME: "RPNLogistic"
  MASK_ON: False
  RESNETS:
    DEPTH: 50
  ROI_HEADS:
    NAME: "ROIHeadsLogisticGMMNew"
    NUM_CLASSES: 20
INPUT:
  MIN_SIZE_TRAIN: (480, 512, 544, 576, 608, 640, 672, 704, 736, 768, 800)
  MIN_SIZE_TEST: 800
DATASETS:
  TRAIN: ('voc_custom_train',)
  TEST: ('voc_custom_val',)
SOLVER:
  IMS_PER_BATCH: 16
  BASE_LR: 0.02
  STEPS: (12000, 16000)
  MAX_ITER: 18000  # 17.4 epochs
  WARMUP_ITERS: 100
VOS:
  STARTING_ITER: 12000
  SAMPLE_NUMBER: 1000
DATALOADER:
    NUM_WORKERS: 8  # Depends on the available memory
[11/10 21:52:52] detectron2 INFO: Running with full config:
CUDNN_BENCHMARK: false
DATALOADER:
  ASPECT_RATIO_GROUPING: true
  FILTER_EMPTY_ANNOTATIONS: true
  NUM_WORKERS: 8
  REPEAT_SQRT: true
  REPEAT_THRESHOLD: 0.0
  SAMPLER_TRAIN: TrainingSampler
DATASETS:
  PRECOMPUTED_PROPOSAL_TOPK_TEST: 1000
  PRECOMPUTED_PROPOSAL_TOPK_TRAIN: 2000
  PROPOSAL_FILES_TEST: []
  PROPOSAL_FILES_TRAIN: []
  TEST:
  - voc_custom_val
  TRAIN:
  - voc_custom_train
FLOAT32_PRECISION: ''
GLOBAL:
  HACK: 1.0
INPUT:
  CROP:
    ENABLED: false
    SIZE:
    - 0.9
    - 0.9
    TYPE: relative_range
  FORMAT: BGR
  MASK_FORMAT: polygon
  MAX_SIZE_TEST: 1333
  MAX_SIZE_TRAIN: 1333
  MIN_SIZE_TEST: 800
  MIN_SIZE_TRAIN:
  - 480
  - 512
  - 544
  - 576
  - 608
  - 640
  - 672
  - 704
  - 736
  - 768
  - 800
  MIN_SIZE_TRAIN_SAMPLING: choice
  RANDOM_FLIP: horizontal
MODEL:
  ANCHOR_GENERATOR:
    ANGLES:
    - - -90
      - 0
      - 90
    ASPECT_RATIOS:
    - - 0.5
      - 1.0
      - 2.0
    NAME: DefaultAnchorGenerator
    OFFSET: 0.0
    SIZES:
    - - 32
    - - 64
    - - 128
    - - 256
    - - 512
  BACKBONE:
    FREEZE_AT: 2
    NAME: build_resnet_fpn_backbone
  DEVICE: cuda
  FPN:
    FUSE_TYPE: sum
    IN_FEATURES:
    - res2
    - res3
    - res4
    - res5
    NORM: ''
    OUT_CHANNELS: 256
  KEYPOINT_ON: false
  LOAD_PROPOSALS: false
  MASK_ON: false
  META_ARCHITECTURE: GeneralizedRCNNLogisticGMM
  PANOPTIC_FPN:
    COMBINE:
      ENABLED: true
      INSTANCES_CONFIDENCE_THRESH: 0.5
      OVERLAP_THRESH: 0.5
      STUFF_AREA_LIMIT: 4096
    INSTANCE_LOSS_WEIGHT: 1.0
  PIXEL_MEAN:
  - 103.53
  - 116.28
  - 123.675
  PIXEL_STD:
  - 1.0
  - 1.0
  - 1.0
  PROBABILISTIC_MODELING:
    ANNEALING_STEP: 0
    BBOX_COV_LOSS:
      COVARIANCE_TYPE: diagonal
      NAME: none
      NUM_SAMPLES: 1000
    CLS_VAR_LOSS:
      NAME: none
      NUM_SAMPLES: 3
    DROPOUT_RATE: 0.0
    MC_DROPOUT: {}
  PROPOSAL_GENERATOR:
    MIN_SIZE: 0
    NAME: RPN
  RESNETS:
    DEFORM_MODULATED: false
    DEFORM_NUM_GROUPS: 1
    DEFORM_ON_PER_STAGE:
    - false
    - false
    - false
    - false
    DEPTH: 50
    NORM: FrozenBN
    NUM_GROUPS: 1
    OUT_FEATURES:
    - res2
    - res3
    - res4
    - res5
    RES2_OUT_CHANNELS: 256
    RES5_DILATION: 1
    STEM_OUT_CHANNELS: 64
    STRIDE_IN_1X1: true
    WIDTH_PER_GROUP: 64
  RETINANET:
    BBOX_REG_LOSS_TYPE: smooth_l1
    BBOX_REG_WEIGHTS: &id002
    - 1.0
    - 1.0
    - 1.0
    - 1.0
    FOCAL_LOSS_ALPHA: 0.25
    FOCAL_LOSS_GAMMA: 2.0
    IN_FEATURES:
    - p3
    - p4
    - p5
    - p6
    - p7
    IOU_LABELS:
    - 0
    - -1
    - 1
    IOU_THRESHOLDS:
    - 0.4
    - 0.5
    NMS_THRESH_TEST: 0.5
    NORM: ''
    NUM_CLASSES: 80
    NUM_CONVS: 4
    PRIOR_PROB: 0.01
    SCORE_THRESH_TEST: 0.05
    SMOOTH_L1_LOSS_BETA: 0.1
    TOPK_CANDIDATES_TEST: 1000
  ROI_BOX_CASCADE_HEAD:
    BBOX_REG_WEIGHTS:
    - &id001
      - 10.0
      - 10.0
      - 5.0
      - 5.0
    - - 20.0
      - 20.0
      - 10.0
      - 10.0
    - - 30.0
      - 30.0
      - 15.0
      - 15.0
    IOUS:
    - 0.5
    - 0.6
    - 0.7
  ROI_BOX_HEAD:
    BBOX_REG_LOSS_TYPE: smooth_l1
    BBOX_REG_LOSS_WEIGHT: 1.0
    BBOX_REG_WEIGHTS: *id001
    CLS_AGNOSTIC_BBOX_REG: false
    CONV_DIM: 256
    DROPOUT_RATE: 0.0
    FC_DIM: 1024
    FED_LOSS_FREQ_WEIGHT_POWER: 0.5
    FED_LOSS_NUM_CLASSES: 50
    NAME: FastRCNNConvFCHead
    NORM: ''
    NUM_CONV: 0
    NUM_FC: 2
    POOLER_RESOLUTION: 7
    POOLER_SAMPLING_RATIO: 0
    POOLER_TYPE: ROIAlignV2
    SMOOTH_L1_BETA: 0.0
    TRAIN_ON_PRED_BOXES: false
    USE_FED_LOSS: false
    USE_SIGMOID_CE: false
  ROI_HEADS:
    BATCH_SIZE_PER_IMAGE: 512
    IN_FEATURES:
    - p2
    - p3
    - p4
    - p5
    IOU_LABELS:
    - 0
    - 1
    IOU_THRESHOLDS:
    - 0.5
    NAME: ROIHeadsLogisticGMMNew
    NMS_THRESH_TEST: 0.5
    NUM_CLASSES: 20
    POSITIVE_FRACTION: 0.25
    PROPOSAL_APPEND_GT: true
    SCORE_THRESH_TEST: 0.05
  ROI_KEYPOINT_HEAD:
    CONV_DIMS:
    - 512
    - 512
    - 512
    - 512
    - 512
    - 512
    - 512
    - 512
    LOSS_WEIGHT: 1.0
    MIN_KEYPOINTS_PER_IMAGE: 1
    NAME: KRCNNConvDeconvUpsampleHead
    NORMALIZE_LOSS_BY_VISIBLE_KEYPOINTS: true
    NUM_KEYPOINTS: 17
    POOLER_RESOLUTION: 14
    POOLER_SAMPLING_RATIO: 0
    POOLER_TYPE: ROIAlignV2
  ROI_MASK_HEAD:
    CLS_AGNOSTIC_MASK: false
    CONV_DIM: 256
    NAME: MaskRCNNConvUpsampleHead
    NORM: ''
    NUM_CONV: 4
    POOLER_RESOLUTION: 14
    POOLER_SAMPLING_RATIO: 0
    POOLER_TYPE: ROIAlignV2
  RPN:
    BATCH_SIZE_PER_IMAGE: 256
    BBOX_REG_LOSS_TYPE: smooth_l1
    BBOX_REG_LOSS_WEIGHT: 1.0
    BBOX_REG_WEIGHTS: *id002
    BOUNDARY_THRESH: -1
    CONV_DIMS:
    - -1
    HEAD_NAME: StandardRPNHead
    IN_FEATURES:
    - p2
    - p3
    - p4
    - p5
    - p6
    IOU_LABELS:
    - 0
    - -1
    - 1
    IOU_THRESHOLDS:
    - 0.3
    - 0.7
    LOSS_WEIGHT: 1.0
    NMS_THRESH: 0.7
    POSITIVE_FRACTION: 0.5
    POST_NMS_TOPK_TEST: 1000
    POST_NMS_TOPK_TRAIN: 1000
    PRE_NMS_TOPK_TEST: 1000
    PRE_NMS_TOPK_TRAIN: 2000
    SMOOTH_L1_BETA: 0.0
  SEM_SEG_HEAD:
    COMMON_STRIDE: 4
    CONVS_DIM: 128
    IGNORE_VALUE: 255
    IN_FEATURES:
    - p2
    - p3
    - p4
    - p5
    LOSS_WEIGHT: 1.0
    NAME: SemSegFPNHead
    NORM: GN
    NUM_CLASSES: 54
  WEIGHTS: detectron2://ImageNetPretrained/MSRA/R-50.pkl
OUTPUT_DIR: C:\Users\anna_\OneDrive\Dokumente\Object Detection\vos-main/detection/data\VOC-Detection\faster-rcnn\vos\random_seed_0
PROBABILISTIC_INFERENCE:
  AFFINITY_THRESHOLD: 0.7
  BAYES_OD:
    BOX_MERGE_MODE: bayesian_inference
    CLS_MERGE_MODE: bayesian_inference
    DIRCH_PRIOR: uniform
  ENSEMBLES:
    BOX_FUSION_MODE: mixture_of_gaussians
    BOX_MERGE_MODE: pre_nms
    RANDOM_SEED_NUMS:
    - 0
    - 1000
    - 2000
    - 3000
    - 4000
  ENSEMBLES_DROPOUT: {}
  INFERENCE_MODE: standard_nms
  MC_DROPOUT:
    ENABLE: false
    NUM_RUNS: 1
SEED: 0
SOLVER:
  AMP:
    ENABLED: false
  BASE_LR: 0.02
  BASE_LR_END: 0.0
  BIAS_LR_FACTOR: 1.0
  CHECKPOINT_PERIOD: 210000
  CLIP_GRADIENTS:
    CLIP_TYPE: value
    CLIP_VALUE: 1.0
    ENABLED: false
    NORM_TYPE: 2.0
  GAMMA: 0.1
  IMS_PER_BATCH: 16
  LR_SCHEDULER_NAME: WarmupMultiStepLR
  MAX_ITER: 18000
  MOMENTUM: 0.9
  NESTEROV: false
  NUM_DECAYS: 3
  REFERENCE_WORLD_SIZE: 0
  RESCALE_INTERVAL: false
  STEPS:
  - 12000
  - 16000
  WARMUP_FACTOR: 0.001
  WARMUP_ITERS: 100
  WARMUP_METHOD: linear
  WEIGHT_DECAY: 0.0001
  WEIGHT_DECAY_BIAS: null
  WEIGHT_DECAY_NORM: 0.0
TEST:
  AUG:
    ENABLED: false
    FLIP: true
    MAX_SIZE: 4000
    MIN_SIZES:
    - 400
    - 500
    - 600
    - 700
    - 800
    - 900
    - 1000
    - 1100
    - 1200
  DETECTIONS_PER_IMAGE: 100
  EVAL_PERIOD: 0
  EXPECTED_RESULTS: []
  KEYPOINT_OKS_SIGMAS: []
  PRECISE_BN:
    ENABLED: false
    NUM_ITER: 200
VERSION: 2
VIS_PERIOD: 0
VOS:
  SAMPLE_NUMBER: 1000
  STARTING_ITER: 12000

[11/10 21:52:52] detectron2 INFO: Full config saved to C:\Users\anna_\OneDrive\Dokumente\Object Detection\vos-main/detection/data\VOC-Detection\faster-rcnn\vos\random_seed_0\config.yaml
[11/10 21:52:53] d2.checkpoint.detection_checkpoint INFO: [DetectionCheckpointer] Loading from detectron2://ImageNetPretrained/MSRA/R-50.pkl ...
[11/10 21:53:03] fvcore.common.checkpoint INFO: [Checkpointer] Loading from C:\Users\anna_/.torch/iopath_cache\detectron2/ImageNetPretrained/MSRA\R-50.pkl ...
[11/10 21:53:03] d2.checkpoint.c2_model_loading INFO: Renaming Caffe2 weights ......
[11/10 21:53:03] d2.checkpoint.c2_model_loading INFO: Following weights matched with submodule backbone.bottom_up - Total num: 54
[11/10 21:53:03] fvcore.common.checkpoint WARNING: Some model parameters or buffers are not found in the checkpoint:
[34mbackbone.fpn_lateral2.{bias, weight}[0m
[34mbackbone.fpn_lateral3.{bias, weight}[0m
[34mbackbone.fpn_lateral4.{bias, weight}[0m
[34mbackbone.fpn_lateral5.{bias, weight}[0m
[34mbackbone.fpn_output2.{bias, weight}[0m
[34mbackbone.fpn_output3.{bias, weight}[0m
[34mbackbone.fpn_output4.{bias, weight}[0m
[34mbackbone.fpn_output5.{bias, weight}[0m
[34mproposal_generator.rpn_head.anchor_deltas.{bias, weight}[0m
[34mproposal_generator.rpn_head.conv.{bias, weight}[0m
[34mproposal_generator.rpn_head.objectness_logits.{bias, weight}[0m
[34mroi_heads.box_head.fc1.{bias, weight}[0m
[34mroi_heads.box_head.fc2.{bias, weight}[0m
[34mroi_heads.box_predictor.bbox_pred.{bias, weight}[0m
[34mroi_heads.box_predictor.cls_score.{bias, weight}[0m
[34mroi_heads.logistic_regression.{bias, weight}[0m
[34mroi_heads.weight_energy.{bias, weight}[0m
[11/10 21:53:03] fvcore.common.checkpoint WARNING: The checkpoint state_dict contains keys that are not used by the model:
  [35mfc1000.{bias, weight}[0m
  [35mstem.conv1.bias[0m
